{
  "contract": "M2N-DIAGNOSTIC-MODEL-REQUEST/1.0",
  "task": "FAULT_CLASSIFICATION",
  "data": {
    "split_column": "split",
    "train_values": [
      "train"
    ],
    "validation_values": [
      "val"
    ],
    "calibration_values": [
      "cal"
    ],
    "test_values": [
      "test"
    ],
    "id_columns": [
      "sample_id",
      "split_group"
    ],
    "include_test_labels": true
  },
  "features": {
    "raw_columns": [
      "PS1__mean",
      "PS1__std",
      "PS1__min",
      "PS1__max",
      "PS1__median",
      "PS1__q10",
      "PS1__q90",
      "PS1__rms",
      "PS1__slope",
      "PS1__start",
      "PS1__end",
      "PS1__delta",
      "PS2__mean",
      "PS2__std",
      "PS2__min",
      "PS2__max",
      "PS2__median",
      "PS2__q10",
      "PS2__q90",
      "PS2__rms",
      "PS2__slope",
      "PS2__start",
      "PS2__end",
      "PS2__delta",
      "PS3__mean",
      "PS3__std",
      "PS3__min",
      "PS3__max",
      "PS3__median",
      "PS3__q10",
      "PS3__q90",
      "PS3__rms",
      "PS3__slope",
      "PS3__start",
      "PS3__end",
      "PS3__delta",
      "PS4__mean",
      "PS4__std",
      "PS4__min",
      "PS4__max",
      "PS4__median",
      "PS4__q10",
      "PS4__q90",
      "PS4__rms",
      "PS4__slope",
      "PS4__start",
      "PS4__end",
      "PS4__delta",
      "PS5__mean",
      "PS5__std",
      "PS5__min",
      "PS5__max",
      "PS5__median",
      "PS5__q10",
      "PS5__q90",
      "PS5__rms",
      "PS5__slope",
      "PS5__start",
      "PS5__end",
      "PS5__delta",
      "PS6__mean",
      "PS6__std",
      "PS6__min",
      "PS6__max",
      "PS6__median",
      "PS6__q10",
      "PS6__q90",
      "PS6__rms",
      "PS6__slope",
      "PS6__start",
      "PS6__end",
      "PS6__delta",
      "EPS1__mean",
      "EPS1__std",
      "EPS1__min",
      "EPS1__max",
      "EPS1__median",
      "EPS1__q10",
      "EPS1__q90",
      "EPS1__rms",
      "EPS1__slope",
      "EPS1__start",
      "EPS1__end",
      "EPS1__delta",
      "FS1__mean",
      "FS1__std",
      "FS1__min",
      "FS1__max",
      "FS1__median",
      "FS1__q10",
      "FS1__q90",
      "FS1__rms",
      "FS1__slope",
      "FS1__start",
      "FS1__end",
      "FS1__delta",
      "FS2__mean",
      "FS2__std",
      "FS2__min",
      "FS2__max",
      "FS2__median",
      "FS2__q10",
      "FS2__q90",
      "FS2__rms",
      "FS2__slope",
      "FS2__start",
      "FS2__end",
      "FS2__delta",
      "TS1__mean",
      "TS1__std",
      "TS1__min",
      "TS1__max",
      "TS1__median",
      "TS1__q10",
      "TS1__q90",
      "TS1__rms",
      "TS1__slope",
      "TS1__start",
      "TS1__end",
      "TS1__delta",
      "TS2__mean",
      "TS2__std",
      "TS2__min",
      "TS2__max",
      "TS2__median",
      "TS2__q10",
      "TS2__q90",
      "TS2__rms",
      "TS2__slope",
      "TS2__start",
      "TS2__end",
      "TS2__delta",
      "TS3__mean",
      "TS3__std",
      "TS3__min",
      "TS3__max",
      "TS3__median",
      "TS3__q10",
      "TS3__q90",
      "TS3__rms",
      "TS3__slope",
      "TS3__start",
      "TS3__end",
      "TS3__delta",
      "TS4__mean",
      "TS4__std",
      "TS4__min",
      "TS4__max",
      "TS4__median",
      "TS4__q10",
      "TS4__q90",
      "TS4__rms",
      "TS4__slope",
      "TS4__start",
      "TS4__end",
      "TS4__delta",
      "VS1__mean",
      "VS1__std",
      "VS1__min",
      "VS1__max",
      "VS1__median",
      "VS1__q10",
      "VS1__q90",
      "VS1__rms",
      "VS1__slope",
      "VS1__start",
      "VS1__end",
      "VS1__delta"
    ],
    "mechanism_columns": [
      "CE__mean",
      "CE__std",
      "CE__min",
      "CE__max",
      "CE__median",
      "CE__q10",
      "CE__q90",
      "CE__rms",
      "CE__slope",
      "CE__start",
      "CE__end",
      "CE__delta",
      "CP__mean",
      "CP__std",
      "CP__min",
      "CP__max",
      "CP__median",
      "CP__q10",
      "CP__q90",
      "CP__rms",
      "CP__slope",
      "CP__start",
      "CP__end",
      "CP__delta",
      "SE__mean",
      "SE__std",
      "SE__min",
      "SE__max",
      "SE__median",
      "SE__q10",
      "SE__q90",
      "SE__rms",
      "SE__slope",
      "SE__start",
      "SE__end",
      "SE__delta",
      "DP_PS1_PS2__mean",
      "DP_PS1_PS2__rmsproxy",
      "DP_PS1_PS2__stdproxy",
      "DP_PS2_PS3__mean",
      "DP_PS2_PS3__rmsproxy",
      "DP_PS2_PS3__stdproxy",
      "DP_PS3_PS4__mean",
      "DP_PS3_PS4__rmsproxy",
      "DP_PS3_PS4__stdproxy",
      "DP_PS4_PS5__mean",
      "DP_PS4_PS5__rmsproxy",
      "DP_PS4_PS5__stdproxy",
      "DP_PS5_PS6__mean",
      "DP_PS5_PS6__rmsproxy",
      "DP_PS5_PS6__stdproxy",
      "DP_PS1_PS6__mean",
      "DP_PS1_PS6__rmsproxy",
      "DP_PS1_PS6__stdproxy",
      "FLOW_FS1_FS2__mean_diff",
      "FLOW_FS1_FS2__ratio",
      "PRESSURE_SPAN__mean",
      "HYD_POWER_PROXY_IN__mean",
      "HYD_POWER_PROXY_OUT__mean",
      "POWER_EFF_PROXY__mean",
      "TEMP_TS1_TS2__mean_diff",
      "TEMP_TS3_TS4__mean_diff",
      "TEMP_SPAN__mean",
      "PRESSURE_CV_PS1",
      "PRESSURE_CV_PS2",
      "VIBRATION_TO_POWER__rms_ratio"
    ],
    "views": [
      "RAW",
      "MECHANISM",
      "RAW_PLUS_MECHANISM"
    ]
  },
  "supervision": {
    "label_column": "fault_label"
  },
  "qualification": {
    "min_train_rows": 300,
    "min_validation_rows": 100,
    "min_calibration_rows": 100,
    "min_validation_rows_per_class": 20
  },
  "candidate_policy": {
    "families": [
      "logistic_regression",
      "rbf_svm",
      "random_forest",
      "hist_gradient_boosting"
    ],
    "svm_max_train_rows": 30000,
    "exclusion_note": "MLP remains excluded to preserve the same finite candidate family and compute-budget contract used in the valve baseline; this harder-target experiment tests target difficulty, not a post-test model-library expansion."
  },
  "training": {
    "restarts": [
      101,
      102,
      103
    ],
    "final_seed": 9001
  },
  "selection": {
    "primary_metric": "macro_f1",
    "practical_margin": 0.02,
    "restart_stability": 0.75
  }
}
