{
  "contract": "M2N-DIAGNOSTIC-MODEL-REQUEST/1.0",
  "task": "ANOMALY_DETECTION",
  "data": {
    "split_column": "split",
    "train_values": [
      "train"
    ],
    "validation_values": [
      "val"
    ],
    "calibration_values": [
      "cal"
    ],
    "test_values": [
      "test"
    ],
    "id_columns": [
      "segment",
      "channel"
    ],
    "include_test_labels": true
  },
  "features": {
    "raw_columns": [
      "mean",
      "var",
      "std",
      "len",
      "duration",
      "len_weighted",
      "gaps_squared",
      "n_peaks",
      "smooth10_n_peaks",
      "smooth20_n_peaks",
      "var_div_duration",
      "var_div_len",
      "diff_peaks",
      "diff2_peaks",
      "diff_var",
      "diff2_var",
      "kurtosis",
      "skew"
    ],
    "mechanism_columns": [],
    "views": [
      "RAW"
    ]
  },
  "supervision": {
    "label_column": "fault_label",
    "normal_label": "0"
  },
  "qualification": {
    "min_train_rows": 500,
    "min_validation_rows": 300,
    "min_calibration_rows": 100
  },
  "candidate_policy": {
    "families": [
      "pca_reconstruction",
      "one_class_svm",
      "isolation_forest"
    ],
    "svm_max_train_rows": 30000
  },
  "training": {
    "restarts": [
      101,
      102,
      103
    ],
    "final_seed": 9001
  },
  "selection": {
    "primary_metric": "roc_auc",
    "practical_margin": 0.02,
    "restart_stability": 0.75
  }
}
